apt_id,apt_name,apt_street,apt_city,apt_state,apt_zip,apt_phone,apt_num_rentals,apt_num_reviews,apt_avg_review,apt_latitude,apt_longtitude,apt_description
yervp1v,ReNew Sandy Springs,100 Greyfield Ln,Atlanta,GA,30350,844-711-6903,15,5,3.5,33.99978,-84.34469,"""Now offering in-person, virtual &amp; self-guided tours by appointment! To help stop the spread of COVID-19, face masks are required. Reach out to us today as helping you find the perfect home remains our priority!Designed with your comfort and style in mind, ReNew Sandy Springs offers resort-style one bedroom, two bedroom, and three bedroom apartment homes for rent in Sandy Springs, GA. Each floor plan features high ceilings, modern kitchens with bright white or chestnut cabinetry, granite inspired countertops, and hardwood style plank flooring. Our central Sandy Springs location provides a restful retreat just minutes away from all the conveniences that metro Atlanta and the Roswell Historic District have to offer. The beautifully landscaped neighborhood is within walking distance of the banks of the Chattahoochee River and the Roswell Riverwalk Trail and a short drive to various higher learning institutions such as The Art Institute of Atlanta, Georgia State University, and Georgia Tech. Nearby employers include IBM, Cisco Systems, United Parcel Service, AT&amp;T Mobility, Cox Communications, State Farm, and Newell Rubbermaid. Close to everything yet far from ordinary, you'll love calling ReNew Sandy Springs home!"""
et2wkbq,Overture Buckhead South- 55+ Active Adult ...,658 Lindbergh Dr NE,Atlanta,GA,30324,888-653-5141,68,58,4.5,33.82144,-84.36608,"'At this time we are only offering virtual tours. Please call our office to schedule your personalized tour.Enjoy maintenance free living in a thoughtfully designed one bedroom or two bedroom apartment home surrounded by resort-concept amenities at Overture Buckhead South. We have over 12,000 square feet of community spaces designed for your mind-body-social enjoyment; including a demonstration kitchen, great room, library, resident lounge, theater room, state of the art fitness center or pool. Overture Buckhead South 55+ Apartment Homes are in an unbelievable location with easy access to public transportation, shopping, and dining, as well as major thoroughfares making it one of the most sought after Atlanta neighborhoods.'"
bgfd7gc,AMLI North Point,9000 Beaver Creek Rd,Alpharetta,GA,30022,678-534-5722,34,81,5,34.03655,-84.30931,"""AMLI North Point offers an exclusive and modern lifestyle in Alpharetta, GA. Our brand new apartments provide flawless interiors with a choice of two custom designer finishes, coupled with unparalleled community amenities. Whether it's our resort-style swimming pool, two-story state-of-the-art fitness center, or clubroom, residents are sure to regard our apartments as an elevated standard of living. We are conveniently located adjacent to the scenic Big Creek Greenway Trail, providing countless activities to quench anyone's recreational desires. For exceptional dining, shopping, and entertainment, North Point Mall and Historic Downtown Roswell are just minutes away.Our apartments offer 1 bedroom and 2 bedroom as well as two-story townhome style floor plans that feature gourmet kitchens with chestnut or espresso shaker cabinets; granite countertops and sleek stainless steel appliances; vinyl wood flooring; crown molding; and garden tubs. Some of our select apartments also feature kitchen islands, washers and dryers, custom built-ins, sunrooms, screened porches, and attached garages. AMLI's environmentally conscious LEED Gold certified apartments are evidence of our focus on living green. We are also a smoke-free community, inside and out, to ensure our residents well-being."""
346ytbe,AMLI Parkside,660 Ralph McGill Blvd,Atlanta,GA,30312,844-301-4108,11,20,4.9,33.76465,-84.36594,'Located in the heart of Downtown Atlanta where the bright city lights dance in the background. You will find style and comfort as you settle down in your new home. We are surrounded by exciting entertainment venues and recreational spaces where you can experience a contemporary urban life. We have an outstanding community with a combination of amenities and surroundings to love life on the park!'
1qxj8t5,Retreat at River Park,3100 River Exchange Dr,Sandy Springs,GA,30092,844-280-6673,7,10,4.6,33.96917,-84.26486,"'Take a self-guided tour today or connect with us for a virtual tour. The Retreat at River Park Apartments is centrally located in the heart of Sandy Springs. The community offers six newly renovated and spacious floor plans with one, two, and three-bedroom layouts. Amenities include fully equipped kitchens, walk-in closets, and wood burning fireplaces. The property features a business center, fitness center, dog park, newly renovated clubhouse, and swimming pools.'"
g8y1rxz,AMLI Ponce Park,641 NE North Ave,Atlanta,GA,30308,844-301-4116,29,4,4.8,33.77021,-84.36564,"'AMLI Ponce Park welcomes you to explore our luxury apartments in the historic Old Fourth Ward, a neighborhood rich in history and bursting with energy. Our apartments are perfectly situated near a multitude of entertainment and recreational opportunities including the Historic Old 4th Ward Park, Atlanta Beltline and Ponce City Market. Our luxury Atlanta rental homes central location connects residents to downtown Atlanta, Midtown, and the citys most dynamic neighborhoods.In addition to Ponce City Markets offerings just across the street from us, residents enjoy an array of community amenities including a swimming pool with sun shelf, high-endurance fitness center, versatile clubroom with cyber caf, outdoor kitchen with grills, and more. We also offer a pet park, controlled access gates and a convenient parking garage.We offer one- and two-bedroom floor plans with a choice of two designer interior packages featuring quartz or granite countertops; stainless steel appliances; kitchen islands; washers and dryers; wood plank or high-end tile flooring; and spacious terraces and balconies. Residents will live green because our community is LEED Platinum Certified.'"
2yvwn29,AMLI Decatur,122 W Trinity Pl,Decatur,GA,30030,833-743-5249,45,16,4.9,33.77321,-84.29822,"'AMLIs Downtown Decatur apartments are located in the heart of the hip and walkable town center. Our apartments in Decatur, GA boast first-class amenities in what may be the best location in Metro Atlanta. Decaturs truecolors show in its boutique shopping, eclectic restaurants, live music venues and cultural diversity -- all with a home-town feel.Residents of our Decatur apartments enjoy an array of community amenities including a resort-style swimming pool, high-endurance fitness center, fitness classes on demand, sky lounge with outdoor patio, outdoor kitchen with grills, bocce court, fully-equipped tech center, Starbucks coffee bar, reservable team room, clubroom with game tables, and DIY maker space. Our pet-friendlyDowntown Decatur apartments also have a dog park, pet spa, bike repair room and gated parking garage.AMLIs apartments in Decatur GA and townhomes offer spacious 1, 2 and 3-bedroom floor plans that feature high-end, custom finishes, Bala white granite countertops, Kenmore stainless steel appliances, custom espresso cabinetry, modern subway glass tile backsplashes, wood-style porcelain tile in living areas and baths, Frieze carpet in bedrooms, full-size front load washer and dryer,electronic entry door lock system and more. And residents of our Decatur apartments will live green because our community is targeting LEED Gold.'"
94xq484,AMLI Lenox,3478 Lakeside Dr NE,Atlanta,GA,30326,844-724-7470,25,11,4.0,33.84806,-84.35748,"'AMLI Lenox is ideally situated in Atlantas premier shopping and dining district. Our Lenox apartments are walking distance from Phipps Plaza, Lenox Mall and the Buckhead Financial district, and uniquely located next to Marie Sims Park. Located in the highly acclaimed Sarah Smith school district, our luxury apartments on Lenox Road offer easy access to GA-400, I-85 and the Lenox MARTA station, as well as the airport, Perimeter, Midtown and Downtown.Our apartments near Lenox Square Mall offer exceptional amenities, including rooftop swimming pool and cabana, amenity deck with outdoor living rooms, grilling/dining areas and gardens, rooftop clubroom with outdoor terrace and grilling, state-of-the-art fitness center, co-working style business center, DIY maker space, game room and theater, gated parking garage and pet spa.Exclusive penthouse amenities at AMLIs Lenox apartments include a private clubroom, wine-tasting room, terrace and fitness center.AMLIs apartments on Lenox Road offer spacious one, two and three bedroom floor plans, featuring two designer finish packages, stainless steel ENERGY STAR Whirlpool appliance suite, eurostyle kitchen cabinetry, 3 cm quartz countertops, washers and dryers in every home, gas cooktops, Kember wood finish floors, 10footceilings, walkin closets, glass showers, comfortable soaking tubs and much more.Designed for LEED Gold and smokefree inside and out, AMLIs apartments near Lenox Square Mall offer residents a healthier lifestyle with a lower environmental impact.'"
84dpxn1,AMLI Piedmont Heights,2323 Piedmont Rd NE,Atlanta,GA,30324,844-368-1667,32,6,4.4,33.81804,-84.3667,"'AMLI Piedmont Heights is ideally situated in the Lindbergh community, just steps from great shopping, a growing restaurant scene, eclectic galleries, and beautiful neighborhood parks. Our mid-rise luxury apartments in Atlanta, GA are centrally located between Midtown and Buckhead. The Lindbergh MARTA Station is only a few blocks away, connecting our residents to Hartsfield Jackson International Airport, Downtown Atlanta and many other destinations. And easy access to GA-400 and I-85 makes traveling a breeze'"
04q27w0,Decatur Flats,3145 Misty Creek Dr,Decatur,GA,30033,844-252-0775,7,23,4.1,33.81094,-84.25981,"""Our beautifully remodeled apartment homes are the best Decatur has to offer! Brand new remodeled and never been used! The gorgeous, well-appointed kitchens will be the envy of all of your friends.Our gorgeous and modern new apartment homes are the best you'll find in Decatur! The stylish, well-appointed kitchens are exactly what you've been looking for. Brand new, never been used Stainless Steel appliances, high end Ceiling Fans, Brushed Nickel Hardware & Lighting, nicely tiled bathroom floors, in-wall USB ports, gorgeous Designer Cabinets, condo quality Quartz Countertops, Mosaic Back Splashes! You'll be glad you decided to call Decatur Flats your home!"""
rx6wry1,Square One Apartments,6050 Roswell Rd NE,Sandy Springs,GA,30328,844-690-0814,14,17,4.7,33.9199,-84.3793,"""From the moment you walk through the doors of your apartment in Sandy Springs, Georgia, you will be captivated by the spacious comfort of your new home and luxurious array of amenities such as our fabulous community roof top with a sparkling pool, fire pit, outdoor grilling area and upstairs clubhouse with game room and multiple TV’s overlooking the downtown Atlanta skyline. Our apartments are conveniently located in the downtown Sandy Springs area and walking distance to Whole Foods, Kaiser’s Chophouse, Rize Pizza and other great businesses. You'll find seasonal festivals, art exhibitions, business expos, concerts, and other cultural attractions at the foot of your doorstep. Our brand-new Sandy Springs, GA apartments also provides the perfect escape for you to unwind on your own. Prepare a delicious meal in our state of the art kitchen, stay in touch with friends and family with our reliable WiFi connection, or spend quality time with your pets in our pet park. Should you ever need assistance, our onsite team is available to help you around the clock.*We can't wait to meet you in person! But in the meantime we'll have to meetup online. Schedule your virtual tour today!"""
hd7w3h2,Perimeter 31,31 Perimeter Ctr E,Atlanta,GA,30346,844-364-5402,23,57,4.6,33.92545,-84.3327,'Welcome to Perimeter 31'
qxxg5ky,Flats at Ponce City Market,675 Ponce De Leon Ave NE,Atlanta,GA,30308,844-878-6685,43,30,4.6,33.77269,-84.36518,"'Seeking A Flat On The BeltLine?Wherever you go, the sky-kissing, tall brick tower at Ponce City Market is your beacon for finding your apartment at the Flats at Ponce City Market. Following a years-in-the-making, dramatic revamp, the landmark Sears building is preserved, wholly-renovated, and full of life again. Live upstairs in the Flats at Ponce City Market, and youre connected to the best neighborhoods, offices, retail, and cultural scenery in the city. Hop a lift to your own lofty flat with tall, steel-frame windows, Euro-style fittings, and treetop views. Attend a yoga class in a refashioned rail shed. Pedal to cafes and shopping. Catch farmers markets, festivals, and art shows. FLATS APARTMENTS ARE AVAILABLE AND MOVE-IN READY, RIGHT ON THE ATLANTA BELTLINE, ACROSS FROM THE HISTORIC FOURTH WARD PARK'"
rv0ktq3,Buckhead 960,960 E Paces Ferry Rd NE,Atlanta,GA,30326,866-488-6065,28,7,4.9,33.84729,-84.35633,"""Located in the heart of Buckhead, Buckhead 960 offers you the lifestyle, convenience, and fun of City living!  Enjoy a cup of coffee and stay connected in the Net Cafe' or challenge yourself to a great cardio work out in the Health Studio.  Relax in the Zen garden or entertain your friends by the pool with a great cook-out!   Step out of your door and catch Marta to explore all of what Buckhead &amp; Atlanta have to offer.  Whether it is work or play - you are just minutes from Mercedes Benz Stadium, Philips Arena, the Fox Theater or Atlantic Station.  Experience Atlanta's finest shopping or dining at Phipps Plaza, Lenox Square and The Shops Buckhead Atlanta.   Buckhead 960 offers you the style, convenience, and fun you are looking for!"""
zhzq5pz,The Waterford on Piedmont,530 Piedmont Ave NE,Atlanta,GA,30308,844-569-2712,15,27,4.8,33.7691,-84.38227,"""The Waterford on Piedmont is Midtown Atlanta's perfect destination for city dwellers who seek convenient, sophisticated, and carefree living. These lavishly appointed apartment homes are in an ideal location close to a variety of high-end shopping options on Midtown Mile. The nearby Fox Theatre is Atlanta's premier venue for entertainment, and Phillips Arena is one of the best multipurpose entertainment complexes in the country. Residents of The Waterford on Piedmont are also privy to a stunning collection of art from all over the world at the High Museum of Art. These high-rise apartments in Atlanta offer elegant homes with nine- and ten-foot ceilings and balconies that provide impressive views of Midtown and Downtown Atlanta. Our homes feature a deluxe kitchen that is equipped with modern cabinets and sleek stainless steel appliances that stand out from the durable ALABASTER quartz countertops and glass tile backsplash. Our residences offer additional counter space with a large ..."""
sf0pvd7,AMLI Buckhead,3450 Roxboro Rd NE,Atlanta,GA,30326,844-266-4048,34,5,4.7,33.84828,-84.3545,"'AMLI Buckhead is ideally situated in Atlantas premier shopping and dining district. Our mid-rise Buckhead apartments are walking distance from Phipps Plaza, Lenox Mall and the Buckhead Financial district, and uniquely located next to Marie Sims Park. Located in the highly acclaimed Sarah Smith school district, our luxury apartments in Buckhead offer easy access to GA-400, I-85 and the Lenox MARTA station, as well as the airport, Perimeter, Midtown and Downtown. Our apartments offer exceptional outdoor amenities, including a rooftop deck with movie screen, rooftop lounge, resort-style pool with sun shelf, outdoor kitchen with grills, and lush courtyards. Indoors you will find a high endurance fitness center, tech center, reservable team room, bike storage and repair room, clubroom with game tables, and pet spa. Our apartments offers spacious one- and two-bedroom floor plans, featuring two designer finish packages with stainless steel ENERGY STAR appliances, elegant quartz countertops, refined wood flooring, 10-12 ceilings, washers and dryers, solar shades, balconies or patios, and more. Select AMLI apartments in Buckhead offer kitchen islands, wine storage, and sunrooms.  Designed to achieve LEED Gold certification and smoke-free inside and out, our apartments offer residents a healthier lifestyle with lower environmental impact.'"
gqehqfz,The Mark 7120,7124 Southlake Pky,Morrow,GA,30260,770-648-0161,4,4,3.9,33.55948,-84.33707,"'Welcome home to contemporary living that’s far from ordinary. Our exclusive community amenities Include; Designated Pet Areas, state-of-the art Fitness Center, Lighted Tennis Court, Package Receiving, Playground and Pristine Pool with Outdoor Kitchen and seating area. Our apartment amenities include; Open Sunrooms, Stainless Steel Appliances*, Quartz Countertops*, Brushed Nickel Fixtures*, Ceiling Fan, Dishwasher, Laminate Wood Floors*, Large Kitchens with Breakfast Bar, Large Well Designed Floorplans, Spacious Walk-In Closets, and W/D Hookup. You deserve the best in apartment living, and our community offers an engaging lifestyle for everyone. We invite you to visit or contact us to schedule your personal tour of The Mark 7120 today!'"
6zmtbdt,Cambridge Faire,900 Meadow Glen Pky,Fairburn,GA,30213,844-317-1922,17,1,4,33.53641,-84.58143,"""Our community is conveniently located to Interstate 85 off of Senoia Road. We are only 12 minutes to Hartsfield-Jackson International Airport. We are also conveniently close to many dining and shopping areas including the Avenue in Peachtree City, The Square of Fairburn, The Fayetteville Pavillion, and Kedron Village. We're a short drive to downtown Atlanta, but far enough away to get a break from the busy hustle and bustle of the city!"""
9x5bk96,Elle of Buckhead,235 Pharr Rd NE,Atlanta,GA,30305,844-897-2978,35,35,4.5,33.83686,-84.38019,"'Located in the heart of it all, Elle of Buckhead welcomes you to discover prestigious luxury living at its best! Our beautiful apartment community offers spacious and convenient one and two bedroom apartments for rent. Each of our lavishly built units includes gorgeous gourmet kitchens with beautiful islands and stainless steel sinks, beautiful hardwood floors, spacious walk-in closets, and private balconies with amazing views of the Buckhead area. Elle of Buckhead offers residents full access to our state of the art cardio &amp; yoga center, electric car charging stations, and library. Enjoy a beautiful day out near our gorgeous Zen Gardens or have a family picnic in our outdoor dining courtyard.'"
j6cdsd4,The Rocca,3280 Northside Pky NW,Atlanta,GA,30327,844-263-8141,55,46,4.8,33.84288,-84.426,"""Buckhead Atlanta Apartments - The Rocca Experience Atlanta's full Renaissance  uncompromising convenience and refined luxury are only a few of the characteristics that encompass your life at The Rocca Apartments.  Located in Atlanta's premier residential district The Rocca is minutes from midtown and downtown Atlanta.The Rocca features unique condo inspired apartment homes, luxurious interior design and amenities. Nestled in the Buckhead Vinings communities we boast spacious floor plans and charming features. Our latest addition to the Rocca Piazza at Paces community, offers newly constructed one and two bedroom apartments in Atlanta provide expansive floor plans with condo-inspired features and amenities such as upscale fixtures and flooring, private balconies with stunning views, resort style pool, state-of-the- art fitness complex and European inspired architecture throughout.A rare combination of classic European inspired architecture, resort-style amenities and superior location make for an excellent living experience.  Come see us and reserve your new apartment home today!"""
t1368wc,The Mark at Riverdale,852 Garden Walk Blvd,College Park,GA,30349,770-954-7562,10,12,3.8,33.59555,-84.41769,"'The newly renovated one, two, and three-bedroom units have updated kitchen appliances, quartz countertops, walk-in closets, vinyl plank wood flooring, wood-burning fireplaces, and the option for an on-site personal garage. The community is located off both I-75 and I-285, and just moments from Hartsfield-Jackson Atlanta International Airport and MARTA. The gorgeous spacious apartments are in the booming Atlanta community of College Park.  Cutting edge amenities, meticulously-groomed grounds, and a dedicated staff contributes to a higher standard of living.  The Mark at Riverdale boasts a state of the art 24-Hour fitness center, pristine pool with outdoor kitchen and seating area, sport courts and play ground.  Convenient shopping, award-winning schools, local museums and parks are all close at hand, with sponsored activities to develop new hobbies while getting to know your neighbors.'"
6f2fn0r,Park Creek Apartments,1100 Park Creek Ct,Gainesville,GA,30504,678-707-8205,8,43,4.2,34.29393,-83.85853,"""Ideally situated in the heart of Gainesville, Georgia, Park Creek offers spacious one, two, and three-bedroom Apartment Homes. These pet friendly apartments are minutes from Lake Lanier and designed with excellence in mind. A Cyber Cafe with WiFi, resort style swimming pool, Fitness Center and detached garages are just some of the extra perks of living at Park Creek. This gated community enables you to enjoy privacy and a peaceful atmosphere while being conveniently located near local shopping and fine dining. Park Creek's management and maintenance teams are dedicated to providing exceptional service to all residents. Visit today and come home to Park Creek!"""
wkm5bth,The Reserve at Sugarloaf Apartments,2605 Meadow Church Rd,Duluth,GA,30097,678-534-2029,22,75,4.9,33.99213,-84.09734,"""Nestled in the pristine Sugarloaf Country Club setting, The Reserve at Sugarloaf offers newly renovated one, two, three and four-bedroom apartment homes.  First class quality abounds within this masterfully-planned community.  Our community features high end finishes and resort-style amenities. The Reserve at Sugarloaf is Gwinnett's premier apartment community offering both convenience and style. Voted &quot;Best of Gwinnett&quot; 2010-2018!  Our convenient location provides you with direct access to I-85, Sugar Mills Mall and we are located the Peachtree Ridge School District. Community Blog"""
2b1y559,Mount Vernon Flats at The Perimeter,1265 Mount Vernon Hwy,Atlanta,GA,30338,470-226-5759,20,56,4.5,33.93572,-84.34885,"'Welcome to Mount Vernon Flats at The Perimeter, a tranquil and beautifully landscaped luxury apartment community convenient to all that the Perimeter area has to offer. Our community boasts an extraordinary array of five-star amenities to provide unsurpassed luxury and convenience.                                                                                                                                Kick off your shoes, and settle into the casual elegance of one of the most distinctive luxury apartment communities in all of Perimeter. Take a relaxing dip in one of our sparkling swimming pools. Grab your rackets and enjoy a game of tennis. Come meet new friends at one of our Resident Functions. Mount Vernon Flats at The Perimeter is not your average community...we are so much more.'"
zrmk51y,Aspire Lenox Park,1050 Lenox Park Blvd NE,Atlanta,GA,30319,678-973-4656,21,68,4.8,33.85177,-84.34796,"'1050 Lenox Park is conveniently located close to Lenox Square Mall and across the street from Lenox Park. Five minutes to GA 400 and I- 85. Enjoy the active Buckhead Business Environment and conveniences the area offers while being able to unwind at one of many 5-star restaurants for example Dantannas-Buckhead, Pahahar Bangladeshi Cuisine. Shop at Phipps Plaza or many other high end retail. Oglethorpe University is just down Peachtree Road which has been called one of the finest liberal-arts schools in the country. If you are interested in the Peachtree-DeKalb Airport its just down the road. Come see our Newly Upgraded Homes featuring Granite Countertops, Stainless Steel Appliances, Wood Floor Finishes*, Upgraded Lighting and Hardware Packages!'"
z62gxbw,Lofts at Zebulon,5801 Zebulon Rd,Macon,GA,31210,202-851-2436,35,1,4.8,32.88114,-83.75404,"'Live where convenience meets luxury. The Lofts at Zebulon is an exceptional community offering one, two and three-bedroom options. Select lofts have direct garage access. Our spacious sundeck and saltwater infinity pool are perfect for relaxing and socializing with family and neighbors. The Lofts Team overseeing the community put customer service above all else. We strive to be the best of the best in everything we do. Give us a call today to set up a tour!'"
tjy2w69,Grove at River Place,4501 Sheraton Dr,Macon,GA,31210,478-841-9100,25,15,3.6,32.91676,-83.70045,"'Private, convenient, and luxurious, The Grove at River Place is located a short distance off I-75, near The Shoppes at River Crossing and Riverside Drive. Our superior amenities, such as a 24-hour fitness center, a resort inspired swimming pool with grilling stations, volleyball, a full-size laundry facility, ""tot lot"", and an awesome bark park for our four-legged friends, will leave you awe-struck.Our homes offer unique options to fit your individual style, including sun-rooms, balconies, vaulted ceilings, fireplaces, and built-ins. Cozy up next to your wood burning fireplace after soaking in an oversized tub, or enjoy a peaceful stroll by our pond, all while being minutes from the active life of the city.We are a gated community with key card access, and have done major renovations on site, including new roofing and exterior paint on all buildings, new pool furniture, and clubhouse remodeling.With a new team, renovated units, and our amazing amenities, we\'re sure you\'ll fall in love with Grove at River Place. Visit us online at groveatriverplace.prospectportal.com to apply & become apart of the Mulberry family today!'"
