apt_id,apt_name,apt_street,apt_city,apt_state,apt_zip,apt_phone,apt_num_rentals,apt_num_reviews,apt_avg_review,apt_latitude,apt_longtitude,apt_description
1e3bnh6,The Stratford,5479 NE Glenridge Dr,Atlanta,GA,30342,844-520-2709,24,8,4.8,33.90356,-84.37187,"'Luxury meets convenience and comfort.Welcome to The Stratford where our luxury homes are sure to be a serene tranquil hideaway from the rest of the busy world! Centrally located in Atlanta, our community offers an irresistible combination of residential luxury, convenience, and quality in a contemporary living environment. Our desirable location offers easy access to some of Atlanta’s best attractions; including the Perimeter Mall and Truist Park – home of the Braves. With five spacious floorplans to choose from you can be assured that your time at home will be spent in lavish luxury. Designed with your comfort and convenience in mind, our homes include a first-class array of quality amenities to ensure your time here is everything you dream of in a community. At The Stratford you’ll find spacious walk-in closets, beautiful quartz countertops that are perfect for entertaining, Luxer Package room, common area air purification systems, and elevators to get you where you need to go! After a long hard day of work, you can relax on our beautiful sundeck or mingle in our outdoor social lounge. Never miss a day at the gym with our state-of-the-art fitness center, or you can work-out with man’s best friend at our delightful dog park with agility course! Our exceptional staff is dedicated to always providing the very best experience for our residents!Don’t hesitate, reserve your new home with us today!'"
78pwwsx,Andover at Johns Creek,10840 State Bridge Rd,Johns Creek,GA,30022,844-522-7019,13,25,4.6,34.04367,-84.22262,"'We are now accepting in-person tours via scheduled appointments only. Our virtual tours are also available. Please schedule yours today. Brand New Upgrades Featuring Granite Counters and Stainless Steel Appliances. Andover at Johns Creek offers luxurious and newly renovated apartments in Johns Creek GA as well as upscale amenities and excellent service for our residents. We offer one, two, and three bedroom apartment homes that are sure to please. Whether you want to relax by our resort-style pool or work out in our State-of-the-Art fitness center, we are sure to have something for you! Andover at Johns Creek is located within an excellent school district with students attending Ocee Elementary, Taylor Road Middle and Chattahoochee High School. Furthermore, you can enjoy the convenience of Northpoint Mall, upscale restaurants, shopping, banking and several grocery stores close by. Contact us to schedule a personalized tour today!'"
petpccv,Audubon Briarcliff,3108 Briarcliff Rd NE,Atlanta,GA,30329,678-608-4026,21,15,4.0,33.83838,-84.30898,"'Audubon Briarcliff apartment homes are designed with the utmost attention to detail. After completing multi-million dollar renovations, each apartment home features fully-equipped kitchens with above range microwave, custom cabinets and countertops, wood-grain vinyl flooring, modern light package throughout, brushed nickel fixtures and hardware, full-size washer/dryer, and spa-inspired bathrooms. Distinctive and quality crafted floor plans, spacious in nature and stylish in design. Need a breath of fresh air? Indulge in what nature has to offer with our conveniently located parks such as Briarwood Park, Briarlake Forest Park, and Elwyn John Wildlife Sanctuary.'"
xp2zvdp,Collingwood Apartments,3400 Kimball Bridge Rd,Alpharetta,GA,30022,678-894-2957,7,13,4.9,34.04895,-84.26303,"'Ideally located in the heart of Alpharetta, Collingwood Luxury Apartment Community provides a serene oasis for living a life of sophisticated comfort, near North Fulton’s prestigious business corridor, with the convenience of shopping, dining, nightlife and celebrated schools. Our resort-style community is situated on thirty-two beautifully maintained acres, featuring natural wooded areas, a lake, walking trails, and professionally landscaped common areas. Call today and schedule a private tour with a member of our friendly leasing team. 770-667-3211'"
8emqrj2,Aven Chastain,240 E Belle Isle Rd,Atlanta,GA,30342,844-293-9688,13,1,4.4,33.89017,-84.37995,"'Welcome to Aven Chastain in Sandy Springs, where the convenience of location meets the lifestyle of luxury. Newly renovated, our gated community offers 1, 2 and 3 bedroom apartment homes with large floor plans and exquisite interiors. Our homes boast desirable features including covered patios with storage, vinyl wood floors, designer kitchens with stainless appliances, washer/dryers, USB ports and upgraded fixtures. Our amenities are unbeatable. Take a swim in our resort-style pool or head to our 24-hour fitness center. Enjoy the convenience of Aven Chastain where you can walk to Chastain Park, Starbucks and Sprouts. Your four-legged family member is welcome at our pet friendly community. We are only steps away from award-winning boutique dining, and are within minutes of I-285 and Buckhead, offering easy access to great shopping. You will love one of Atlanta’s most vibrant neighborhoods – a place you want to call home.'"
7wfe9sz,One K,1000 Gables Way NE,Atlanta,GA,30329,844-715-6471,14,nan,nan,33.83163,-84.32143,"'Find the apartment home you’ve been looking for at One K (previously Marquis at Briarcliff) in northeast Atlanta. Located in the beautiful region of Briarcliff Heights, our stunning apartments are surrounded by natural beauty, as well as cultural resources, shopping and entertainment, while being only 20 minutes up I-85 from downtown Atlanta. Our gorgeous 1, 2, and 3-bedroom apartment and townhome floor plans accommodate a variety of lifestyles and needs, featuring spacious walk-in closets, vaulted ceilings, and beautiful wood style flooring. The communal amenities leave nothing to be desired, from a sparkling resort-style pool to a 24-hour, top-tier wellness center, just for you. When you choose our North Druid Hills apartments, you can be proud to invite friends or coworkers over for some poolside grilling, with the peace of mind of controlled access and 24-hour emergency maintenance. This coveted enclave of northeast Atlanta is home to several of the area’s most prestigious employers and educational institutions, including Georgia State, Emory, and Mercer University. There is no place to live in Atlanta, GA quite like One K! Let us set you up with a private tour so you can experience the difference today!'"
ht6dhg3,Emory Point,855 Emory Point Dr NE,Atlanta,GA,30329,844-288-9077,131,nan,nan,33.80185,-84.3278,"""TOUR YOUR WAY. Meet your new community, on your terms. Our doors are open by appointment-only for both self-guided tours and in-person private tours. Additionally, virtual tours via video chat are still available. That's right, you can safely and securely be granted access to a model unit to envision in-person your new life at our property, on your own terms. Want to learn more about how to schedule a Self-Guided Tour or an In-Person Private Tour? Call or email us today!"""
mdzjgxk,Midwood Forest Apartments,507 Georgia Ave,Forest Park,GA,30297,844-499-1598,3,3,4.0,33.6205,-84.37341,'.'
2b9ccnc,Tens on West,1010 W Peachtree St NW,Atlanta,GA,30309,229-638-6380,53,nan,nan,33.78224,-84.38818,"'Indulge yourself at Tens on West, a community of luxury apartments in Atlanta, Georgia. Featuring beautifully designed apartment homes, countless high-end amenities, and a central location, Tens on West is the area’s most exciting residential development. Come home to gourmet kitchens with stainless steel appliances, space-saving walk-in closets, three rooftop lounge areas, a resort-style pool, an upgraded fitness center, and much more. Plus, with over 14,000 square feet of retail space located on the ground floor of the building, there’s always something new to discover at Tens on West.'"
ms22mel,Sorelle,2399 NE Parkland Dr,Atlanta,GA,30324,855-350-2573,43,51,4.2,33.81979,-84.36471,"""NOW OPEN! Call to schedule your tour TODAY. Appointment Only! (833) 338-7210CONTACT US TODAY!Start your journey at Sorelle Apartments! Sorelle at Lindbergh is a lively upscale Atlanta apartment community located in close proximity to midtown and Buckhead --the city's most dynamic and cosmopolitan neighborhood. Just steps away from world-class shopping, dining and entertainment, Sorelle is redefining life for Atlanta urbanites by providing a unique fusion of style and sophistication, all while retaining an environment of unparalleled quality and excellence—a premier Live / Work / Play location!Residents may choose from studio, one, and two bedroom apartments with upgraded features and a host of exclusive amenities, including a state-of-the-art fitness center, high-speed Internet cafe, controlled VIP access, spacious dog park and a pool area perfect for relaxing or mingling with neighbors.Come wiggle your toes in our picturesque pool, stroll through our pet-friendly community with your favorite furry companion, or have a day out on the town in Atlanta. We know you deserve the very best in apartment living, and our community is designed specifically to ensure you don’t just lease, you live.Sorelle's dedication to distinction ensures that residents enjoy only the highest levels of luxury and leisure and guarantees a superior, more refined living experience for all. Go take a look at our photo gallery and contact us today to schedule an Agent Assisted Tour!"""
1mlr527,Helios,2470 Cheshire Bridge Rd NE,Atlanta,GA,30324,470-240-2460,45,6,4.3,33.82215,-84.35267,"'WELCOME TO HELIOS LUXURY ATLANTA APARTMENTSOur Atlanta Apartments were developed with you in mind.You’re part of the innovative crowd; a visionary, a trendsetter.Introducing Helios Luxury Apartments. For those, like you, who rise above the norm.We’re not just another apartment community. We’re an apartment experience – and we want you to be the first to enjoy it.If an active lifestyle is your thing, enjoy the two-story fitness center with commercial Strength and Cardio Equipment, Rotating Rock Wall, Yoga/Spin Room, Personal Training, Virtual Training and Group Fitness Classes. For the professional, our co-working spaces allow you to be buttoned-up or collaborate – just footsteps from your home. To get social, head up to The Observatory, our indoor-outdoor Sky Lounge for multi-media, gaming, and relaxation, or down to the resort-style pool with grill stations and fire-pit seating.Helios is now leasing for immediate move-ins. Located central to Emory, Buckhead, Brookhaven, Piedmont Park, Virginia Highland, and Morningside, don’t miss your opportunity to live where you belong – above the norm. Call us today to schedule your personal tour!We’re not just another apartment community. We’re an apartment experience.'"
3dywydf,Golden Gate Townhomes,1 Chatfield Dr,Stone Mountain,GA,30083,844-393-1670,50,25,2.6,33.81788,-84.19302,"'Beautiful, newly renovated homes in a secure gated community. Located just minutes from the 285 and Stone Mountain Park. Apply today and get your first month free! Come on in, agents are always available to show the units as well as the model. No appointment necessary!!'"
y8pk27s,Autumn Vista,1500 Boggs Rd,Duluth,GA,30096,844-246-8106,19,10,4.0,33.95556,-84.09542,"""Welcome home to Autumn Vista Apartment Homes, a pet-friendly community in Duluth, Georgia, where you'll enjoy the quality of life you deserve in the heart of Gwinnett County. Our tranquil setting is just minutes from I-85 and GA-316 with convenience to Gwinnett Place Mall shopping, fine dining, and entertainment. Make luxury part of every day at Autumn Vista Apartments, a lavish community marked by unparalleled comfort and resort-inspired amenitiesFeel pampered as soon as you set foot on our well-tended grounds with gorgeous views and lush surroundings. Dip your toes in the sparkling swimming pool for a refreshing escape from your everyday worries or enjoy the tranquility of a cozy afternoon on our sundeck. You can soak up the warmth outdoors or wind down in our resident clubhouse for some added privacy. It’s easy to stay on top of your fitness goals with a 24-hour gym that’s fully equipped with strength and cardio equipment right on site. Your furry friends will love it here as well Autumn Vista also boasts amenities that include a Bark Park. We are certain that you will love making Autumn Vista your new home.  Contact our professional, on-site management team today to schedule a personal tour of Autumn VistaAs for our modern Duluth apartments, they come with one, two, and three-bedroom floor plans, as well as generous living space and stylish design. Each of our newly renovated homes also features private patios or balconies, garden tubs, and washer/dryer connections. Don’t wait any longer—call today and let’s schedule a tour of your new apartment in Duluth!"""
etkf05p,The Park on Windy Hill,2121 Windy Hill Rd SE,Marietta,GA,30060,844-617-0467,15,34,3.0,33.90057,-84.49548,"""Discover a tranquil paradise made just for you at The Park on Windy Hill in Marietta, Georgia, close to nearby Cumberland and Smyrna. Situated around a pristine lake with a sparkling fountain in its center, our stylishly renovated apartment community is a lush oasis full of mature trees and well-maintained landscaping. Just minutes away from Hwy 285 and I-75, we have convenient access to all the shopping, dining, and entertainment you love. You'll feel at home in each of our four unique one or two bedroom floor plans. Every one of our premium value, contemporary apartment homes is full of features of the best quality. At the end of the day when you’re ready to unwind, you can find peace of mind in your modern home inside our inviting community.COVID-19: In light of the Coronavirus concerns we are all faced with, Bridge Property Management's office hours and touring procedures are changing. Please contact the office directly with any questions you may have. Whether you are a resident or a prospective renter, we are confident that we will meet all your needs as a resident and/or facilitate a smooth move-in process for all of you who are looking to join the Bridge community."""
5208f4n,Estates at Barrington,301 Barrington Hall Dr,Macon,GA,31220,478-845-4692,5,nan,nan,32.88685,-83.81586,"'The Estates at Barrington offers the very best of country club living without the country club cost! Our community features spacious 1, 2, and 3-bedroom homes with views of the beautiful golf course! Workout in our 24-hour fitness center and then cool off in our sparkling pool. Estates at Barrington also offers a wonderful variety of activities to enjoy! Take a stroll or run on our scenic nature trail, play a round of tennis or enjoy a volleyball match with friends or family! Grill out at our grilling and picnic areas and meet your neighbors at one of our community events! You will find an elegant atmosphere at the Estates at Barrington with a dedicated onsite team! Come see why Estates at Barrington is the perfect place for you to call home!'"
yzwvbgv,Veritas at East Cobb,730 Franklin Rd SE,Marietta,GA,30067,844-493-0028,8,1,3.9,33.93233,-84.50291,"'Welcome to Veritas at East Cobb, a residential community featuring two bedroom apartments in Marietta, GA. Spacious layouts and amenities welcome you home, along with exceptional service and an ideal location within walking distance to shopping, dining and entertainment options. Are you looking for an apartment for rent in Marietta, GA? Contact our friendly, professional office staff to schedule a tour today.'"
gzxp2rz,Vida Apartments by ARIUM I,1355 Graves Rd,Norcross,GA,30093,202-851-7417,10,3,3.9,33.89807,-84.21462,"'Welcome to Vida Apartments by ARIUM - an apartment community located in the heart of Norcross and right off Jimmy Carter Blvd. Minutes from downtown, walking distance from shopping and restaurants, minutes form Gwinnett Transit.'"
t60zd0b,Elevation 3505 Apartment Homes,3505 Redwine Rd,Atlanta,GA,30344,678-217-8133,17,9,4.9,33.66443,-84.50057,"'Welcome to Elevation 3505, a stunning Atlanta, GA apartment community featuring impressive one, two, and three bedroom residences and townhomes for those looking for something truly special. On the hunt for quality apartments for rent in East Point, GA? Elevation 3505 has all you could want and more. Our spacious, intelligently-designed residences feature all the indulgent amenities and perks that you expect in a luxury apartment, and then some. Meticulously-designed, modern cabinetry, hip open floor plans, stainless-steel appliance packages, kitchens with giant farm style sinks, and brushed knuckle hardware throughout give our homes an elegant and refined aesthetic while never compromising on comfort. Every morning, residents are greeted with our breathtaking grounds, complete with beautiful landscaping, stunning views, a resort-style swimming pool, and tennis courts. At Elevation 3505, no detail has gone unattended.Residents interested in East Point, GA apartments will take notice of our incredible location, nestled just a short drive from downtown Atlanta in an amazing neighborhood with more than its fair share of the city’s famed food, nightlife, and natural beauty—not to mention a great school district. With shopping like Camp Creek Marketplace and magnificent parks like the North Camp Creek Parkway Natural Preserve, our valued residents get the best of both worlds. Get in touch today to schedule your tour!'"
mgywrdh,Preserve at Mill Creek,1400 Mall of Georgia Blvd,Buford,GA,30519,866-929-1044,4,16,4.9,34.05946,-83.99942,"""Featuring beautiful one, two, and three-bedroom apartment homes in Buford, Georgia. When you step into your new living space at Preserve at Mill Creek, you’re welcomed home by a spacious open layout brimming with natural light, a sleek contemporary kitchen, a private patio or balcony, and top-quality finishes throughout. When it’s time to relax and unwind, you’ll find a whole host of upscale features just steps from your front door. From a resort-style swimming pool with poolside gazebos to lighted tennis courts, a fully-equipped fitness center and much more, these stunning apartments in Buford, GA offer a unique blend of luxury, comfort, and style. And it’s all topped off with community's ideal location. Close to major roadways and within walking distance from an extensive selection of excellent shopping, dining and entertainment options, everything you need is always within reach at Preserve at Mill Creek Apartment Homes."""
n8k1k7n,Radius West Midtown,464 Bishop St NW,Atlanta,GA,30318,844-297-1815,28,18,4.2,33.79242,-84.40365,"'Welcome home to Radius West Midtown, where you define your RADIUS! If you’ve been looking for a refined city living experience, you’ve come to the right place. Radius West Midtown offers one- and two-bedroom apartment homes that feature open floor plans, world-class amenities, and optimal convenience. Outside, you’ll find all of the excitement the city has to offer, from entertainment to great dining experiences and more. Come see the elegance of Radius West Midtown for yourself. Find your new home today!'"
ywxq4hs,Park on Clairmont,3180 Clairmont Rd,Atlanta,GA,30329,404-647-0385,9,2,3.9,33.8522,-84.31537,"'Welcome to the Park on Clairmont in Atlanta, Georgia. Our attention to detail and our commitment to excellence is revealed the moment you arrive to your newly renovated community. Our voluminous and unique floor plans paired with our sophisticated amenities provide an opportunity for you to relish in simple daily activities. You will feel at ease when you can comfortably relax at home, soak up the sun by our refreshing swimming pool with sun deck, work out in our fitness center, or enjoy our brand new pavilion with grilling station and fire pits! You will fall in love with the array of apartment luxuries available at Park on Clairmont; namely, a fully-equipped kitchen with granite counter tops, black or stainless appliance package including a microwave, stylish tile back splash, under mount sinks with goose neck faucets, upgraded cabinetry, extended faux wood flooring (all areas except bedrooms), laundry room with washer and dryer, spacious bathroom with stunning granite counter top'"
jvgtde7,Aspire Perimeter,5385 Peachtree Dunwoody Rd NE,Atlanta,GA,30342,404-920-4145,45,52,4.6,33.90216,-84.35206,"'Aspire Perimeter in Atlanta, GA, features one, two, and three bedroom apartments and townhomes ranging from 650 sq. ft. to 2360 sq. ft. We are located in a prime location within a mile of I-285 and GA-400.'"
p2m8fet,Ashford at Spring Lake,6200 Bakers Ferry Rd SW,Atlanta,GA,30331,404-382-5578,16,6,3.7,33.72517,-84.57072,"'Ashford at Spring Lake apartments provide a beautiful escape from the hustle and bustle of in-city Atlanta living. The large yet comfortable apartments belong to a community that embodies Southern hospitality with its welcoming environment and charming features. Enjoy the conveniences of Atlanta living, but return home to the serenity created by spacious floor plans and beautifully landscaped grounds. The amenities make this community an ideal place to unwind, while the location provides access to excellent shopping, dining, entertainment, and a short commute to Marta and the Atlanta airport. Discover your new retreat when you rent an apartment at Ashford at Spring Lake.'"
2bljd1b,Indigo Apartments,150 Orchard Brook Dr,Gainesville,GA,30504,844-274-8241,9,nan,nan,34.27626,-83.8834,"""Indigo has been transformed into a stunning, envy-inspiring community residents are proud to call home. Each home features hardwood-style flooring, modern cabinetry, stainless steel appliances, designer lighting and so much more! Indigo's thoughtfully designed amenities will promote wellness and soothe your mind. Conveniently located in Hall County near Lake Lanier, our community provides numerous dining, shopping, and entertainment options right outside of your front door. Plus - we're less than 3 miles from Downtown Gainesville! Offering a variety of spacious 2 & 3 bedroom apartment homes, we’re the expert at combining quality and comfort, making Indigo Apartments an ideal place to call home."""
r5bkc20,Azure at Riverside,648 Whisper Trl,Austell,GA,30168,844-744-5388,20,10,3.4,33.7759,-84.57431,"'Azure at Riverside offers spacious living, on beautifully manicured grounds. Our one, two and three bedroom apartment homes are wonderful for efficient and affordable living. The exterior setting features grilling areas, a sparkling pool, sports court and pet stations. Azure at Riverside is the perfect place to call home.Superior Design, craftsmanship and construction, along with skilled and attentive service personnel make Azure at Riverside the hallmark of quality in Cobb County.Azure at Riverside apartment community has a distinct advantage of bringing you tranquil living and exterior features that you can enjoy.'"
cct9cwd,220 West Townhomes,220 Boy Scout Rd,Augusta,GA,30909,844-201-1189,1,3,3.2,33.50878,-82.04215,"'This property is managed by Beztak, 2020 recipient of the US Best Managed Companies, sponsored by Deloitte Private and The Wall Street Journal.  Call and let us tell you why!Centrally located in Augusta, Georgia 220 West Townhomes offers 2 bedrooms featuring W/D hook ups, fireplaces, and private balconies. We are in close proximity to I-20 and I-28, and the perfect place to call your new home!Virtual and Contact-Free Leasing and Move-In Available - Self-Guided Tours with Lockboxes- FaceTime/Skype Tours- Apply & Sign Online'"
5x21kvn,05 Buckhead,3242 Peachtree Rd NW,Atlanta,GA,30305,844-440-3524,37,3,4.9,33.84336,-84.37259,"'05 Buckhead is the original building of its caliber, featuring some of the largest high rise floor plans in Atlanta. At 05 we offer a choice to those who expect luxury and prefer the freedom and convenience of renting. Located by the intersection of Peachtree and Piedmont Roads, O5 Buckhead is poised at the center of everything: business, shopping, fine dining, and entertainment. Our services and amenities rival those of the finest five-star hotels.'"
