apt_id,apt_name,apt_street,apt_city,apt_state,apt_zip,apt_phone,apt_num_rentals,apt_num_reviews,apt_avg_review,apt_latitude,apt_longtitude,apt_description
5yc311m,Walton Westside,790 Huff Rd NW,Atlanta,GA,30318,404-850-9964,28,47,4.8,33.78703,-84.41368,"'An urban enclave in West Midtown Atlanta, Walton Westside brings modern luxury apartment living to one of the most dynamic and active areas in Atlanta. You’ll love living close to all of the new shops and restaurants that our area is attracting. Our community is focused on the health conscious and we are pleased to say we are smoke-free and offer lifestyle balancing amenities like our fitness center. With easy access to I-85 and I-75, Walton Westside is close to everything you could need. The neighborhood is easily navigated and it’s so easy to walk or bike to the eclectic art galleries that The Goat Farm is known for. Enjoy the legendary restaurants and shopping that the Westside Provisions District in West Midtown has to offer.Walton Westside offers an incredible wealthy-feeling living experience with stunning one or two bedroom apartment homes. Our homes are built with oversized windows and designer kitchens that integrate upgraded cabinetry, granite counters, stainless steel appliances, large islands, pendant lighting and backsplashes that are perfect for entertaining! Our exclusive amenities such as a rooftop deck with city views and enticing pool with a comfortable sundeck will provide the relaxed lifestyle you crave. We also welcome your pet and offer a dog run and onsite pet grooming salon!The photo gallery shows the detail and comfort of this urban oasis that will make you want to call Westside apartments home. Schedule your appointment or drop by and visit us today for your personal tour. We’d love to show you around!'"
ftbf24s,Century Skyline,396 Piedmont Ave NE,Atlanta,GA,30308,844-209-1309,17,41,4.3,33.76491,-84.38241,"""Dare to live a high-end lifestyle at Century Skyline Apartments—an incredible rental community in the South Midtown area near the GSU. Quality service is our top commitment, and this is why we’ve appointed our apartments in Downtown Atlanta with everything you need to turn your future home into a living space that feels just right.Luxury and accessibility collide inside your one or two-bedroom apartment for rent in Atlanta. Our layouts span between 845 and 1,529 square feet and boast a full slate of fixtures meant to enhance your comfort. The hardwood flooring, 9' ceilings, and spacious walk-in closets, along with the washer/dryer sets and private balconies, transform these charming floor plans into your unique nest of indulgence. Plus, it is further outfitted with SmartHome technology featuring voice-activated lighting, Alexa, and USB outlets to cater to your connected lifestyle.Apart from having contemporary interior designs and beautiful city views, our community is also conveniently located close to I-85 and the MARTA network. This means you’ll have no problem getting to work since Georgia Power or Georgia Tech are a short commute away. It will be just as easy to pick groceries at Publix. As for entertainment, our address puts you near top retail and leisure destinations, including the Atlantic Station. There are also plenty of onsite recreation areas, such as a rooftop deck with green space and a saltwater pool, a clubhouse with a game area and a Starbucks coffee bar, as well as a fully-equipped fitness studio. And we didn’t even mention the resident business center, furnished units, and 24/7 maintenance that grant you even more ease.Become a resident in one of our pet-friendly apartments in Atlanta, GA. Reach out today and we’ll give you all the details!"""
3vp1ptf,Highland Walk Apartments,701 NE Highland Ave,Atlanta,GA,30312,888-223-9617,26,8,4.9,33.76102,-84.36462,"""Located minutes from Downtown and Midtown Atlanta and on the Beltline - Highland Walk is nestled in the urban community of Old Fourth Ward/ Inman Park/Virginia Highland - Highland Walk appeals to a vibrant in town community of residents who live near work and understand the day doesn't end at 5pm. Highland Walk offers unsurpassed accommodations in one of Atlanta's most desirable neighborhoods. As an inviting mid-rise community, with skyline views and hardwood floors, we offer such conveniences as a neighborhood pub, sushi restaurant, frozen yogurt shop and dry cleaner on-site."""
s8dqbl5,Highland View Apartments,784 Ponce De Leon Pl,Atlanta,GA,30306,404-267-6696,13,3,5,33.77544,-84.36472,"'Highland View is a small apartment community in Virginia Highlands.  We offer studio, 1, and 2 bedroom apartment homes.  Our community features direct access to the Atlanta Beltline (with over 30 miles of trails), a 24-hour fitness center, and is walking distance to multiple parks, including Piedmont Park and Old Fourth Ward Park.There are so many reasons to make Highland View your new home. Direct access to the Atlanta Beltline and Ponce City Market makes our location perfect for walking, especially up to Highland Avenue. Highland View Apartments gives its residents a unique mixture of all Atlanta has to offer. The Virginia Highland area is filled with tree-lined sidewalks, charming residences, and is brimming with diverse entertainment.'"
g35mz0z,Gwinnett Square,4175 Satellite Blvd,Duluth,GA,30096,678-824-1139,10,5,3.7,33.94963,-84.15279,"'Find the distinguished lifestyle you’re looking for at Gwinnett Square. A world of comfort awaits you as soon as you reach your doorstep. Your new home is spacious and laid out in a uniquely appealing manner that will accommodate all your decoration ideas. Examples of design elements at Gwinnett Square include black kitchen appliances, brushed nickel fixtures, private balcony or patio, maple cabinets, walk-in closets, fireplaces and washer and dryer connections.Every one of our residents has access to ample parking space and is welcome to use our onsite laundry facilities. Beyond the comfort and elegance of your home is a vast array of exciting amenities! Picnics areas equipped with BBQ grills are ideal to have friends over and enjoy the great Georgia summers. Our active residents love to swim laps in our beautiful sparkling swimming pool or enjoy a good workout in our state-of-the-art fitness center! What’s more, our clubhouse and pool area offer complimentary Wi-Fi access!'"
r0jjyf1,Amber Grove at Olley Creek FKA-Crescent Sq...,2050 Austell Rd SW,Marietta,GA,30008,844-237-5025,33,1,3.9,33.90474,-84.56849,"'Welcome to Amber Grove at Olley Creek Apartment Homes - a First Communities community, located in Marietta, GA, off Austell Road. This gated community is fully renovated with spacious one, two, three and four bedroom apartment homes. Apartment homes feature full size washer/dryer connections, fully upgraded appliance package, cable and WiFi access ready, and private balconies. Community amenities include a community garden, renovated fitness center, spacious pool with a sundeck and a FREE after school program. As a First Communities community, residents enjoy the benefits of monthly community events, friendly onsite staff, and the maintenance staff are available six days a week in addition to our 24-hour onsite emergency services.'"
me7ev9k,Azalea Park at Sandy Springs,8805 Dunwoody Pl,Sandy Springs,GA,30350,678-292-5732,20,19,3.9,33.99397,-84.34553,"'We’re offering contact-free tours! Call us for details!Nestled beneath towering pines and mature hardwoods, Azalea Park Apartments in Sandy Springs offers huge apartment homes (up to 1580 square feet) spacious and distinctive one, two and three bedroom garden and townhome plans, with features such as fireplaces, sunrooms, renovated kitchens and baths, stainless steel appliances and built-in bookshelves. In your leisure time, play tennis or work out in the fitness center, then relax on your patio or by one of our three swim\xadming pools. Our desirable Sandy Springs location in Fulton County provides nearby shopping, dining and entertainment at North Point or Perimeter Malls, excellent neighborhood schools, plus easy access to all of Atlanta via GA 400 or MARTA. Come to Azalea Park Apartments in Sandy Springs and discover your new home!'"
sy8n307,Dunwoody Crossing,700 Summit Place Dr,Sandy Springs,GA,30350,678-292-5867,23,24,3.5,33.99327,-84.34479,"""We’re offering contact-free tours! Call us for details!We're Upgrading! So should You!! Newly Renovated Kitchens. Stainless Steel Appliances. Within Walking Distance to Public Transportation, Shopping and Restaurants. Welcome to Dunwoody Crossing, a great place to call home. Our over-sized living spaces feature formal dining areas, living rooms, eat in kitchen and/or breakfast bars, washer/dryer connections, and private patios and balconies. Our community amenities include two lighted tennis courts and a fabulous swimming pool with a sun deck and free poolside wi-fi. We are conveniently located off buslines 85 and 87, near the finest shopping, dining, and entertainment. Call today to see your new home at Dunwoody Crossing.Complimentary Wifi at the Pool! One bedrooms from the $900's, Two bedrooms from the $1200's."""
xnk0jwm,Harbor Pointe,500 Harbor Pointe Pky,Sandy Springs,GA,30350,678-292-5989,30,14,3.7,33.97065,-84.3716,"'We’re offering contact-free tours! Call us for details!At Harbor Pointe Apartments near Morgan Falls Park, you’ll find a beautiful wooded community and exceptional amenities. Located in prestigious Sandy Springs in Fulton County and nestled along the Chattahoochee River, Harbor Pointe offers the perfect mix of comfort and convenience.All the best of Atlanta is at your fingertips, with easy access to Roswell Road, GA 400, I-285 and the nearby North Springs MARTA Station. Premiere shopping, restaurants and entertainment, including North Point and Perimeter Malls, are just minutes away. Choose from spacious one or two bedroom, garden or town home apartments, offering options such as newly renovated kitchens with stainless steel appliances, updated baths, fireplaces, accent walls, and garages. Work out in the fitness/exercise center, play tennis, catch up on work in the business center, and then relax at one of the two sparkling pools. It’s all here for you at Harbor Pointe Apartments in Sandy Springs!'"
nd3k1cn,Wood Creek at Roswell,600 Old Holcomb Bridge Rd,Roswell,GA,30076,678-292-5667,25,3,3.9,34.02674,-84.32765,"'We’re offering contact-free tours! Call us for details!In Roswell in Fulton County, just off GA 400, Wood Creek Apartments combines the convenience of an affordable suburban community with easy access to the entire Atlanta area. Dining, entertainment and shopping are just minutes away at North Point or Perimeter Malls, and the Chattahoochee River and North Springs MARTA station are close by. Spacious and unique one, two and three-bedroom floor plans (up to 1425 square feet) are available, with great features such as fireplaces, vaulted ceilings, stainless steel appliances, faux hardwood flooring and storage areas. The large swimming pool with free Wi-Fi overlooks the tennis courts, with barbecue areas nearby. Wood Creek offers a convenient residential setting to complement an active life. Come home to quality and affordable Roswell apartment living!'"
dntj44k,Regency Square,3250 Mercer University Dr,Chamblee,GA,30341,844-578-9493,26,9,4.0,33.87636,-84.25583,"'We’re offering contact-free tours! Call us for details!Welcome to Regency Square Apartments in Chamblee, Atlanta’s most unique mid-rise community! Our outstanding location is inside The Perimeter in DeKalb County, near I-85 and I-285, across from Mercer University and minutes from downtown, Buckhead and Perim\xadeter Mall. You’ll find spacious one and two bedroom plans with newly renovated kitchens with stainless steel appliances, plus features such as vaulted ceilings, faux hardwood flooring, fireplaces and walk-in closets, surrounded by elegant architecture with landscaped courtyards, plus the convenience of elevators and free covered parking. Enjoy the sparkling pool with free Wi-Fi and heated spa, tennis court, and complete fitness center in a fantastic new clubhouse. Experience the ultimate in convenient luxury apartment living!. Ask about our student package!'"
80b2p60,Morgans Landing,7843 Roswell Rd,Sandy Springs,GA,30350,678-292-5711,23,7,4.0,33.96963,-84.35915,"'We’re offering contact-free tours! Call us for details!Beautiful Morgan’s Landing Apartments are conveniently located in the prestigious Sandy Springs area in Fulton County of North Atlanta, within easy reach of GA 400 and I-285. North Point and Perimeter Malls are nearby, as are the Chattahoochee River parks, great schools and the North Springs MARTA station. Our gracious one, two and three-bedroom garden, loft and townhome apartments are exceptionally large (up to 1650 square feet) offer newly renovated kitchens with stainless steel appliances, plus upgraded baths. You’ll enjoy the lovely pool with free Wi-Fi, tennis courts and carefree lifestyle. Come to Morgan’s Landing Apartments in Sandy Springs and live the good life!'"
phgbgyt,Largo Pointe/Windsor Arms,12409 Largo Dr,Savannah,GA,31419,912-200-5481,4,3,2.9,31.97881,-81.15237,"'Come discover one of Savannah’s most desirable and affordable apartment communities. Largo Pointe/Windsor Arms is a quiet professional community within walking distance to schools, churches and shopping centers.Nowhere else is your lifestyle more evident than here at Largo Pointe/Windsor Arms… casual and uncomplicated, with all the comforts to which you’re accustomed.'"
zdce14y,Revel100,100 Peaks Rdg,Acworth,GA,30102,844-321-0359,3,25,3.8,34.09518,-84.58185,"'Our apartments in Acworth, GA feature expansive floor plans that are newly renovated! Our open-concept kitchens include all of your modern luxuries such as stainless steel appliances, a custom backsplash, and black fusion counter tops. The open floor plans include a breakfast bar with striking views to your living and dining room. Spend time outdoors from the comfort of your private screened-in balcony! You will also find upgraded brushed nickel lighting and plumbing fixtures throughout your apartment home. The contemporary amenities don’t stop there! Easily control the temperature in your home with your Nest thermostat or charge your technology with USB plug-ins! To top it off, our Acworth, GA apartments for rent come with your own private laundry room fully equipped with a full-sized washer and dryer. Spacious bathrooms and walk-in closets with custom built shelving complete our modern floor plans, perfect for anyone! At Revel100, you’ll also fall in love with all of the community amenities we offer. Enjoy a free membership to our state-of-the-art fitness center, or relax at our gorgeous resort style pool with expansive sundeck and a fire pit. Have fun at our playground or make use of our on-site business center. And there’s plenty for our furry friends too! They’ll love our lush landscaping, pet stations, and can run and play at the bark park! With all our community has to offer, it will be an easy choice to make Revel100 your new home!'"
xpl9mmp,Broadway Townhomes,1951 Southampton Rd,College Park,GA,30349,844-290-4619,2,3,2.9,33.61652,-84.45341,"'Large, Updated 2 Bedroom in College Park - Broadway Townhomes is a peaceful and thriving community. With easy access to Hartsfield-Jackson Airport and to all major interstates, Broadway invites you to enjoy amenities such as huge closet spacing, private patios and balconies and large kitchens. Retreat home to a quaint one, two, or three-bedroom townhomes professionally managed and dedicated to servicing your needs and concerns.(RLNE6079593)'"
5zkgz1m,Georgetown Crossing,1015 King George Blvd,Savannah,GA,31419,912-257-4883,8,14,5.0,31.98411,-81.21955,"'This renovated one bedroom apartment home with stylish black appliances will be available soon! - Georgetown Crossing features one- and two-bedroom floorplans with an array of amenities and features to choose from to make an easy decision on your new home.Residents enjoy our resort-style pool and jacuzzi, outdoor kitchen and grilling station, beautifully renovated clubhouse with a complimentary Starbucks coffee bar. Animals are family too, so our pet-friendly community welcomes four-legged friends-- we even have a bark park for dogs in the community to run around and play with each other.Youll love being close to everythingin a busy business and shopping district, excellent schools and the short distance to Tybee beach, youll find you have everything you need nearby.Your new homes interior is designed thoughtfully to provide stylish and convenient upgrades. Choose from a variety of options such as sleek black or stainless-steel appliances, a private balcony or patio, soak in a large garden bathroom tub and enjoy living in one of our spacious floorplans.Community and Home Amenities: Resort-style saltwater pool and jacuzzi Outdoor kitchen and grilling station Newly renovated Clubhouse Complimentary Starbucks Coffee Bar Leash-free Bark Park with Agility Equipment Courtyard with outdoor firepit and hammocks BBQ Grills and Picnic Areas Sand Volleyball Court 24/7 Clothes Care Center Scenic Pond Detached garages available for extra storage Designated Recreational Parking 24/7 Emergency Maintenance On-site, friendly management Online Resident Portal and bill pay Newly designed interiors Black and Stainless-Steel appliances Large Garden Bathtubs Built-in Bookshelves Washed and Dryer Connections Vaulted Ceilings Wood Burning Fireplace Scenic viewsExcellent service can be expected at Georgetown Crossing, our friendly staff is ready to help you find the perfect home. Stop by the community or call today to schedule a tour-- we cant wait to meet you! Come home to Georgetown Crossing to see how were redefining a new standard of southern charm in Savannah.Georgetown Crossing Apartments1015 King George Blvd. Savannah, GA 31419(912) 244-8857georgetown-crossing-@rent.dynasty.comMonday  Friday: 9 AM - 6 PMSaturday: 10 AM - 5 PMwww.georgetowncrossingapartments.com(RLNE5432129)'"
7wpme4x,AMLI Arts Center,1240 W Peachtree St,Atlanta,GA,30309,844-402-0587,54,1,4.9,33.7888,-84.38857,"'Two bedroom apartments available for immediate move in! Perfect for couples and friends. AMLI Arts Center offers high-rise city apartments ideally situated walking distance to Piedmont Park, the Woodruff Arts Center, Atlantic Station, and an array of shopping and dining options. Located in the Midtown Arts District, we offer easy access to the Arts Center MARTA station, I-75/I-85, and GA 400, as well as Buckhead and Downtown. AMLI Arts Center offers spacious one- and two-bedroom floor plans featuring your choice of two artfully designed finish packages, with stainless steel ENERGY STAR appliances, quartz countertops, NEST thermostats, front-loading washers and dryers, custom Elfa walk-in closets, private balconies and more. Sky Level homes include upgraded features such as Kember wood flooring throughout, Samsung and Bosh Appliances, and more. Tour today and see for yourself.  Experience luxurious amenities, including a rooftop skyline lounge, expansive pool deck, outdoor movie theater, dog park and pet spa. Interior complete with  two-story fitness center, clubroom with game tables and big screen TVs, coffee lounge, business center with private conference room, gated parking garage with electric car charging stations, and bike storage and repair room. AMLI Arts Center is a LEED Gold Certified Community and smoke-free inside and out. We provide Midtown residents an outstanding living environment, healthier lifestyle, and lower environmental impact.'"
xnvzz3q,Parkside Apartments,3214 Valley Bluff Dr,Doraville,GA,30340,678-902-5767,3,13,3.3,33.88981,-84.22854,"""Parkside Apartments in Doraville, GA, a wooded retreat that will take you back to the days when space meant more. Including a wide selection of delightful amenities and features like vaulted ceilings, tennis courts, a community picnic area, a sparkling swimming pool, a fitness center and so much more. Conveniently located for easy access to all of Atlanta's major arteries, entertainment, and unique cuisine dinning. We welcome you to a unique and special place where the comforts meet or exceed your expectation. Choose from a selection of spacious one and two bedroom apartments, with Loft Style also available. Enjoy fully equipped kitchens with a refrigerator, disposal, stove and dishwasher, optional living rooms, screened porches or balconies.  Contact us today to discuss your new apartment and make your move to Parkside Apartments."""
65k4czr,3500 The Vine,3500 Peachtree Corners Cir,Norcross,GA,30092,877-681-6238,7,15,3.4,33.95142,-84.2525,"'At 3500 The Vine apartments, located in the city of Norcross, you’ll find beautifully landscaped grounds, a variety of resident privileges, enjoyable community events and striking homes with modern interiors that define a distinctive living experience.Just steps from your door, you’ll have access to a fitness center, modern clubhouse with a WiFi cafe, a resort-style pool and sundeck, and much more.Enjoy your life within this inspired neighborhood, conveniently located near I-85 and 1-285 with quick access all the perimeter area of Atlanta has to offer. Additionally you’ll appreciate convenient access to local shopping and entertainment off of Peachtree Industrial Boulevard.'"
f8v1llv,Arbor Gates at Buckhead,2500 Pine Tree Rd NE,Atlanta,GA,30324,678-973-4668,4,15,4.3,33.82633,-84.35906,"""All of the apartment homes at Arbor Gates feature the finest in modern amenities. Our roomy living spaces include high-speed Internet access, with ample closet space and storage. Take advantage of the large swimming pool or clubhouse, and enjoy the convenience of an in-unit washer and dryer. Our professional management will assist you in meeting all of your needs. At Arbor Gates, you'll feel right at home."""
5xq0btm,Princeton Place,820 Canton Rd,Marietta,GA,30060,844-545-0261,7,2,4.0,33.97306,-84.54551,"""Princeton Place offers a mixture of comfort and style. You'll find this community at 820 Canton Rd. in the 30060 area of Marietta. The leasing team is ready to help you find your ideal place. Experience a new standard at Princeton Place."""
elcfhnm,Flats 1500,1500 Brandon Glen Way NE,Conyers,GA,30012,770-609-4653,18,2,2.9,33.67432,-83.99114,
4esl75l,PARC AT POOLER,2200 Old Quacco Rd,Pooler,GA,31322,844-219-2356,40,nan,nan,32.07942,-81.26863,'Welcome Home to Parc at Pooler. Our community is now open for in-person tours! We still offer the option of a virtual tour or a self-guided tour. Please feel free to contact us with questions on any of these options.'
ez9l47n,Aylesbury Farms,6115 Abbotts Bridge Rd,Duluth,GA,30097,678-392-4459,10,16,3.2,34.04925,-84.18248,"'BRAND NEW BLACK KITCHEN APPLIANCE PACKAGE INCLUDING MICROWAVE AND SIDE BY SIDE REFRIGERATOR WITH WATER AND ICE MAKER !! Welcome to Aylesbury Farms Apartments. Our property features a natural recreation area featuring a jogging trail, a picnic pavilion, a multi-use playground, two sparkling swimming pools featuring a spa, a waterfall, and a poolside cabana, two lighted tennis courts, a fitness center with personal training stations, an aerobics room, a luxurious clubhouse featuring a fully-equipped business center, a conference room,one and two car garages with remote access, a digital alarm system with 24-hour monitoring available, a controlled access entry, a covered bus stop, and an award-winning community design with meticulous landscaping highlighted by wildflower gardens. Our apartment homes feature French and atrium doors with overhead transoms, crown moulding, chair railings, a spacious laundry area with Brand NEW Maytag washer and dryers, garden tubs, European-styled cabinets with finished interiors, frost-free refrigerators with ice makers, self-cleaning ovens, garbage disposals, and oversized private balconies with fans. Select apartments include trey and cathedral ceilings, fireplaces with marble hearths, his/her walk-in closets, cultured marble vanities with double sinks, mirrored dining room accent walls, custom built wine racks, and double pane palladian and bay windows. For the luxury and convenience you want, make your new home at Aylesbury Farms Apartments.'"
5zwl63n,The Exchange at 1105,1105 Davis Rd,Lagrange,GA,30241,844-822-4671,6,nan,nan,33.02862,-84.98689,
kkp6k28,Ford Factory Lofts,699 Ponce De Leon Ave NE,Atlanta,GA,30308,470-381-1621,5,5,3.9,33.77308,-84.36411,"""Discover your new apartment at Ford Factory Lofts in Atlanta, GA. Schedule a time to check out the apartment floorplan options. You'll experience a great selection of amenities at this community. Some of these include: dining rooms, vaulted ceilings, and smoke free options.  From location to floorplan options, the leasing team is ready and waiting to help you find your perfect floorplan option. Drop by the leasing office to find out the current floorplan availability."""
