apt_id,apt_name,apt_street,apt_city,apt_state,apt_zip,apt_phone,apt_num_rentals,apt_num_reviews,apt_avg_review,apt_latitude,apt_longtitude,apt_description
8507ch0,Broadstone Sugar Hill,5010 W Broad St,Sugar Hill,GA,30518,770-799-8620,78,1,5.0,34.1065,-84.0355,"'The heart of Sugar Hill revolves around local pride. Flourish in a classic southern community without giving up the spoils of urban living. Stroll down Broad Street and enjoy mom-and-pop boutiques, unique shopping, and fresh farm-to-table dining. Simply cross the street for an outdoor concert at The Bowl or a show at the E-Center. Sugar Hill allows you the opportunity to enjoy a relaxed pace of life without sacrificing modern, urban living. And at its center, you will find Broadstone Sugar Hill- where main street meets modern'"
7x1j2ly,Adley City Springs,6075 Roswell Rd,Sandy Springs,GA,30328,678-331-5893,78,1,5.0,33.92072,-84.37844,"'Adley City Springs Apartments offers many amenities to make sure you enjoy your time here with us! Enjoy luxury living by lounging around our rooftop salt-water pool with a poolside aqua lounge, or by getting social at our cozy outdoor kitchen with a lounge area or at our golf simulator lounge. Residents can get energized in our two-story fitness center, which offers high-endurance equipment and free weights. Our upscale clubhouse also features a kitchen with lounging areas, gourmet coffee and hot tea bar, social lounge with gaming and TVs, cyber lounge, conference room, and movie theater. For your convenience, take advantage of our on-site paw spa, online rent payment and maintenance request services, and elevator access. Contact our friendly leasing staff to set up an appointment for a personal tour of your new home. We look forward to seeing you at Adley City Springs Apartments!'"
3zjvf3d,Broadstone Junction,500 Thrasher St NW,Norcross,GA,30071,844-395-8465,33,nan,nan,33.93623,-84.22015,"'Unlike other apartment communities, Broadstone Junction celebrates its rich history by protecting its heritage. Nestled at Broadstone Junction are two crown-jewel, adaptive-reuse buildings that will be home to 90 unique apartment homes. These loft style gems celebrate the architecturally rich history of Broadstone Junction. Comingled with The Lofts are two brand new apartment buildings, The Flats, with traditional aesthetics that blend Broadstone Junction into the fabric of the neighborhood.'"
vfz0lqd,Inkwell Decatur,2588 Decatur Village Way,Decatur,GA,30033,678-331-5967,40,nan,nan,33.79643,-84.28418,"'NOW OPEN! Brand New! Welcome to Inkwell Decatur Apartments! Enjoy the upscale and inviting atmosphere of our brand new community, located in Decatur, Georgia. We offer beautiful one and two bedroom apartments infused with style and modern convenience. Featuring luxury vinyl hardwood plank throughout!'"
fffnhjs,The Irby,65 Irby Ave,Atlanta,GA,30305,844-335-5284,62,1,4.9,33.8414,-84.38103,"'Welcome to refined living. The Irby is crafted to surround you in extravagance while keeping you connected to the charm of Buckhead. The Irby seamlessly combines posh city living and upscale design. From the elegant entry to the exclusive Skylounge, The Irby celebrates living modern while staying classic.'"
9teved6,The Alastair at Aria Village,6500 Aria Blvd,Sandy Springs,GA,30328,844-239-0147,68,2,4.6,33.93353,-84.36504,"'Welcome home to The Alastair at Aria Village Apartments! Our apartments in Sandy Springs, GA are ready to elevate your lifestyle. Blending luxury, comfort, and an excellent location with outstanding services and impeccable amenities, we are here to make sure you live the life you desire.A saltwater pool with fire pits and lounge spaces, on-site concierge, two-story fitness center, resident event center, co-working spaces, private game room, full catering kitchen with private dining, and electric car charging stations are all part of The Alastair at Aria Village experience. Inside your new home, you’ll find even more comfort and convenience, including smart thermostats, built-in bookshelves, linen cabinets, wine racks, quartz or granite countertops, Sonos wireless speakers, digital thermostats, and many more. Private balconies or patios, and large kitchen islands with seating are also available in most of our one, two, and three-bedroom layouts.Located within walking distance from the Mercedes-Benz US Headquarters and with easy access to GA-400 and I-285, along Abernathy road, our location puts everything you need within reach. From the plethora of retail shops at Perimeter Mall to the convenience of having Costco nearby and the beautiful Chattahoochee River Recreation Area, there’s always something to do or explore when you live at The Alastair at Aria Village Apartments.Come learn more about how you can make your dream home in Sandy Springs come true and call us to schedule a tour!'"
cd80n3f,MAA Centennial Park,305 Centennial Olympic Park Dr NW,Atlanta,GA,30313,470-427-2443,65,15,4.4,33.76307,-84.39116,"""TOUR YOUR WAY! We have a tour to fit your needs- virtual, self-guided, or with a leasing agent. Welcome to MAA Centennial Park, a new luxury apartment complex in Downtown Atlanta in the Centennial Park area. MAA Centennial Park is also located near the Georgia Aquarium, World of Coca-Cola, CNN and Philips Arena. And you're only minutes away from two MARTA stations, where you'll be able to visit all of Atlanta's other fun neighborhoods. When you come home to your new pet-friendly apartment, you'll love the luxury finishes found in many different floorplans, as well as energy saving features like NEST thermostats, LED lighting and energy efficient ceiling fans. You'll love the amenities our community offers, such as our electric car charging stations located in our controlled access parking area, rooftop sky deck and Aqua lounge with a resort style pool and private cabanas and bike storage with Dero Fixit stands."""
sr9hlv4,Whisperwood Apartments,6029 Flat Rock Rd,Columbus,GA,31907,877-351-3859,17,13,3.7,32.53157,-84.87028,"'Welcome to Whisperwood, the home of your next adventure! You’ll find a fantastic home, in a premier location packaged with unbeatable amenities. Close to Columbus State University and only minutes from Fort Benning, we’re near everything you need, when you need it.  With six pools, hot tubs, tennis courts, a group fitness studio, an indoor racquetball court, and movie theater, there’s always something to do that’s already part of your apartment experience. We offer military discounts and preferred employers specials. Check out what we have available online, then call to schedule a tour and let us show you around!'"
0g6gh01,1824 Defoor,1824 Defoor Ave NW,Atlanta,GA,30318,844-641-2982,35,33,4.7,33.80493,-84.42552,"""The scene is Atlanta’s thriving Westside, the vanguard of shopping and dining, inspired energy and industrial rebirth. The look is classic cottage and private retreat, as tasteful and welcoming as you could ask for. The feel is brilliantly modern, with wide-open interiors that let you craft your surroundings to whatever best expresses your heart and mind. With an awesome array of studio, one, two and three bedroom apartments, you're sure to find whatever best suits your lifestyle. Choose from our 13 different layouts ranging from 716 to 1881 square feet.With a location just off Howell Mill Road, an apartment at 1824 Defoor puts you in immediate proximity to Westside Provisions District – and everything this amazing area has to offer."""
t1qzpt8,The Point At Westside,370 Northside Dr,Atlanta,GA,30318,877-335-1804,15,20,4.1,33.76535,-84.40475,"'Discover home at The Point at Westside Atlanta apartments. Our community offers residents the unique combination of comfort, convenience, and luxury in the heart of the city. Each of our homes are airy and inviting, not to mention fully equipped with the finest amenities. Gourmet kitchens include energy-efficient stainless-steel appliances, breakfast bars, and elegant, custom-crafted cabinetry for a sophisticated but cozy feel. Expansive living rooms come cable-ready for movie nights or kicking on your favorite playlist for a gathering of friends. Enjoy morning coffee or an evening drink on your very own private patio or balcony, and take in the sights and sounds of your oasis in the heart of the city.Inside our remote-access community, residents are free to enjoy all of our exciting amenities. Spend an afternoon in our courtyard taking a dip in the pool or soaking up some rays in our lounge area. Our state-of-the-art fitness center is always here for you to get your sweat on, and our cyber cafe is the ideal spot to work from home. Package retrieval services, night patrol, and on-site management is available to help you take care of all the details.Located in the heart of Atlanta, our residents have quick access to I-75, I-85, and I-20 as well as the Hartsfield-Jackson International Airport, and Atlantic Station. For fun in the area, look no further than the Georgia Aquarium, World of Coke, and the Atlanta Zoo. There’s something for everyone here at The Point at Westside.'"
g41tntx,Arabelle Perimeter,1110 Hammond Dr NE,Atlanta,GA,30328,678-812-6049,49,14,4.4,33.91957,-84.35046,"'Where Luxury and Convenience ConvergeArabelle Perimeter unveils an exceptional portrait of living. A unique fusion of style and sophistication, our apartment residences reflect your contemporary flair. Enjoy the life you deserve. When you live at Arabelle Perimeter, your address says it all.'"
tehkkb9,Sugarloaf Grove,1850 Duluth Hwy,Lawrenceville,GA,30043,206-536-2300,95,1,5.0,33.97481,-84.07558,"'Where Everything Comes To LifeJust picture it: living as you’ve always imagined…exactly where you want to be. Well now you can. Because at Sugarloaf Grove in Duluth, you’ll experience the finest in boutique apartment living. From the stylish one, two, and three-bedroom floor plans to the Insta-worthy amenities, everything on your wish list is covered. Cool on the outside. Warm on the inside. It’s exceptional living. Luxury included.'"
pf4mgzt,Alleia Luxury Apartments,73 Highlands Blvd,Savannah,GA,31407,844-266-0038,27,nan,nan,32.17174,-81.22703,"""Welcome to Alleia Luxury Apartments! Our brand new, premier apartments are located in the Pooler area of Savannah, Georgia. As a resident, you'll enjoy modern interior design in our one, two, and three bedroom apartments and townhomes, along with an extensive selection of unparalleled amenities. All of our floorplans offer high-end features and sleek finishes, such as lofty nine-foot ceilings, a two-tone paint scheme, modern disc and pendant lighting, two-inch faux-wooden blinds, plush carpet, power-saving digital programmable thermostats, home intrusion alarms with optional monitoring, and framed vanity mirrors. The gourmet kitchens feature executive chef undermount sinks, custom routed wood cabinetry with sleek hardware, designer tile backsplashes, stainless steel appliances, and granite countertops. Select homes also include a relaxing patio or balcony, walk-in showers with rain shower heads, large walk-in closets, soaking tubs, upscale wood-finish flooring, and/or retreat views."""
dc3kbnh,SLX Atlanta,5211 Peachtree Blvd,Chamblee,GA,30341,770-637-5769,124,2,5.0,33.89067,-84.30927,"'Welcome to SLX Atlanta, a brand new apartment community offering studio, one, two and three bedroom apartment homes. Our residences come alive with high-end kitchens, stainless steel appliances, designer cabinets, French-style refrigerators, frameless glass shower enclosures, and full closet systems with drawers and shelves. Step outside your luxe home and enjoy our countless number of amenities, including a Hollywood-style draped porte-cochere entry, our heated infinity edge saline plunge pool, tanning islands, a 2,000-square-foot fitness center with virtual trainers, Club Pure for parties and gatherings, The Sky Lounge for rooftop alfresco private dining, a lighted pet park, a crystal meditation garden and much more.'"
347xfmf,SouthLawn Lawrenceville,30 S Clayton St,Lawrenceville,GA,30046,678-812-6067,129,6,4.9,33.9529,-83.98777,"'Located just 30 miles northeast of Atlanta, Lawrenceville’s SouthLawn is a 33-acre mixed-use community with a blend of refined apartments, spacious townhomes, stylish single family homes, and abundant retail. Just steps away from the historic Lawrenceville Square, SouthLawn is surrounded by a multitude of entertainment, shopping and dining options. Even more, an overlooking location on the Lawrenceville Lawn grants easy access to countless concerts, festivals and movie nights throughout the year.'"
ctx07ze,The View at Woodstock,900 View Dr,Woodstock,GA,30189,833-711-6022,41,1,5,34.08233,-84.54743,"'The View at Woodstock Apartments in Woodstock, Georgia is a brand new, luxury apartment community located within minutes of Town Center shops and restaurants.  Featuring an astounding selection of unit floorplans, our mission at The View at Woodstock is to provide comfort, convenience, and overall luxurious experience that will encourage you to renew your lease for years to come.  With an amazing rhythm of energy and style, our apartment community will exceed all of your expectations for maintenance-free apartment living.  Residents will love our resort-style swimming pool, elegant clubhouse, and ""grab-n-go"" breakfast and coffee bar.  If you ever feel like escaping the confines of your apartment home, explore our community and form neighborly bonds that will last a lifetime.  It\'s all waiting for you at The View at Woodstock in the beautiful truly unexpected Town Center are of Woodstock, Georgia.'"
ypq4vxs,Ardmore at Rice Hope,1332 Mulberry Blvd,Port Wentworth,GA,31407,912-228-3253,3,nan,nan,32.22329,-81.18742,"'Welcome to Ardmore at Rice Hope! Our Port Wentworth Apartments for rent have everything you need when looking for a home. Enjoy spacious one, two, and three floor plan homes that are equipped with energy-efficient appliances, wood-style vinyl flooring, designer cabinetry and a community that features a resort-style swimming pool, covered yoga area, elite fitness center and more! Call and schedule a virtual tour of our apartments in Port Wentworth today!  Pooler, Rincon and Garden City are just a short drive away!Text us at (912) 215-6663'"
ymf5lbr,Artesia Big Creek,6405 Rex Ln,Alpharetta,GA,30005,470-695-3774,28,14,4.1,34.10725,-84.22526,"'Welcome to Artesia Big Creek Apartments! Enjoy the upscale and inviting atmosphere of our brand new smoke free community, located in Alpharetta, Georgia. We offer beautiful one, two, and three bedroom apartments infused with style and modern convenience.Impressive character awaits you inside your apartment, where you will enjoy a spacious, open design, perfect for both entertaining and relaxing! Every apartment features lofty nine-foot ceilings, 2"" faux-wooden blinds, ceiling fans with lighting, modern track and pendant lighting, granite countertops in the bathrooms, plush carpet, power-saving digital programmable thermostats, home intrusion alarms with optional monitoring, garage parking, framed vanity mirrors, and a washer/dryer in-home. Our gourmet kitchens offer stainless steel appliances, executive chef undermount sinks, designer tile backsplashes, granite countertops, and sleek modern cabinetry. Select homes also include upscale wood-finish flooring, walk-in showers with rain shower heads, luxurious soaking tubs, large walk-in closets, and/or a relaxing patio or balcony!Artesia Big Creek Apartments offers many amenities to make sure you enjoy your time here with us! Enjoy luxury living by lounging around our relaxing saltwater pool with a sundeck and cabanas. Residents can get energized in our fitness center, which offers high-endurance equipment and free weights, as well as a yoga room with ballet barre and spin room. Our upscale clubhouse also features a gourmet coffee and hot tea bar, social lounge with kitchen, gaming, and TV\'s, cyber cafe, and conference room. For your convenience, take advantage of our on-site dog spa, courtyards with lounging and grilling areas, Luxer One package system, bike repair and storage room, online rent payment and maintenance request services, and elevator access.'"
hty7q63,Heights Old Peachtree,1045 Old Peachtree Rd NW,Suwanee,GA,30024,833-711-2890,25,nan,nan,34.00182,-84.06955,"'The Heights Old Peachtree Apartments in Suwanee, Georgia is a brand new, luxury apartment community located within minutes of Old Town Suwanee and Sugarloaf Market Place.  Featuring an astounding selection of unit floorplans, our mission at The Heights Old Peachtree is to provide comfort, convenience, and overall luxurious experience that will encourage you to renew your lease for years to come. With an amazing rhythm of energy and style, our apartment community will exceed all of your expections for maintenance-free apartment living.  Residents will love our resort-style swimming pool, elegant clubhouse, and ""grab-n-go"" breakfast and coffee bar.  If you ever feel like escaping the confines of your apartment home, explore our community and form neighborly bonds that will last a lifetime.  It\'s all waiting for you at The Heights Old Peachtree in beautifuly truly unexpected Suwanee, Georgia.'"
xh6gjyq,Modera Reynoldstown,780 Memorial Dr SE,Atlanta,GA,30316,844-570-0824,119,nan,nan,33.7472,-84.36178,"'Theres an undeniable vibe you get when you enter Modera Reynoldstown. Its the life of the party, a serene oasis, and a creative expression, all in one. Its also home to 320 of Reynoldstowns most anticipated new studio, one-, two- and three-bedroom homes. Located in an Atlanta neighborhood celebrated for its friendly nature and central location, Modera Reynoldstown is a new, eclectic fusion of style, comfort and fun. Clink your glass at the hidden speakeasy. Be inspired by some art. Take in a comedy flick on the patio. Or kick back and chill at your poolside cabana. Outside, there is always a new, chef-driven restaurant, trendsetting shop or cultural experience to welcome you, thanks to our location steps from the bustling BeltLine and the beautiful Grant Park. And when you want to welcome guests of your own, wowing them will be easy with stunning features like quartz countertops, wood-plank flooring, and oversized windows that maximize the beauty of your urban surroundings.'"
6602b5r,Marketplace Vista Apartments,1486 Terrell Mill Rd SE,Marietta,GA,30067,770-829-0828,155,nan,nan,33.91879,-84.46954,"""Live luxuriously at Marketplace Vista, a community of apartments in Marietta, Georgia. Consider it the best of both worlds: we offer brand-new luxury floor plans in a close-knit community that’s conveniently located on Terrell Mill Road in Marietta, Georgia. Our one and two bedroom luxury apartment homes combine sophisticated style with trendsetting charm and several lifestyle-enhancing amenities, from a resort-style pool and upscale fitness center to a cyber lounge and a dog spa. With so much to experience, it's no wonder why residents love coming home to Marketplace Vista!"""
fnlrrzs,Elevate West Village,4520 Pine St,Smyrna,GA,30080,678-324-9395,115,1,4.0,33.84408,-84.49205,"'Next-level apartment living has arrived in Smyrna’s thriving West Village. Organic and luxury design combine with contemporary features and gracious amenities to establish a new benchmark for higher living. Everything you need for a complete modern lifestyle – at work, at play, and beyond. And outside your door, the entire retail, restaurant and service offering of pedestrian-friendly West Village, just footsteps away. It’s a higher standard of living, elevated further by a true sense of community. We can’t wait to welcome you home.'"
x6q2p0q,Arya Peachtree,1777 Peachtree St,Atlanta,GA,30309,678-534-5893,267,nan,nan,33.80337,-84.39236,"'Welcome to ARYA Peachtree – brand new, elegantly designed, luxury residences nestled at the southernmost tip of Buckhead in the historic neighborhood of Brookwood. Our modern studio, one-, two-, and three-bedroom homes feature quartz countertops, five-panel interior doors, and GE Energy Star stainless steel appliances. The lavish sophistication continues with lofty ceilings and floor-to-ceiling windows dressed with solar shades. ARYA’s exclusive address boasts a superior proximity to the best Buckhead, and Midtown has to offer with convenient access to I-75, I-85, and GA 400.  Peachtree Road provides quick access to the myriad of nearby dining, shopping, and entertainment offerings, including Phipps Plaza and Piedmont Park. In addition to access to major roadways, ARYA offers accessible ride-share pickup locations for an effortless commute.'"
lf299ze,The Skylark,1099 SE Boulevard,Atlanta,GA,30312,470-588-9937,81,7,4.8,33.72524,-84.36968,
4pjtj1h,Modera Midtown,95 8th St NW,Atlanta,GA,30309,844-433-8866,65,24,4.3,33.78,-84.39002,"'Claim the ultimate domain at Modera Midtown, a hooked-up high-rise with fast-paced appeal. Plug in to Midtown  Atlantas most amped up neighborhood  home to Fox Theatre, High Museum of Art, destination restaurants, and incredible nightlife from Opera Nightclub to Whiskey Park and Atlantic Station. Live in the epicenter of happening Tech Square, a vibrant creative hub boasting the regions most dynamic workspaces and an eclectic mix of savvy young professionals.'"
zwcyjly,Novel Perimeter,5755 Glenridge Dr,Atlanta,GA,30328,844-889-4122,33,4,5.0,33.91173,-84.36108,"'Novel Perimeter is Atlanta’s northern gateway — a vibrant commercial center with well-known shopping, office parks and convenient access via MARTA to downtown Atlanta, Buckhead and Midtown. At this ideal boundary, Novel Perimeter offers spa-like serenity balanced between busy lives and luxurious repose. Nearby workplaces are easy to reach and at the end of the day, Novel Perimeter residents can retreat to a welcome enclave. Modern, elegant apartments share amenities from a fountained courtyard, outdoor fireplace, and kitchen, and tranquil saltwater pool to a 2,500-square-foot gym and drop-in workspaces, to name just a few. Those who live here will gather for yoga, spin classes and ping pong, chat at the complimentary coffee bar and cross paths along the pet run, enjoying a valued sense of being right where they belong.'"
bp1p51b,AMLI Westside,1084 Howell Mill Rd NW,Atlanta,GA,30318,470-419-7836,36,2,4.8,33.78514,-84.41343,"'AMLI’s West Midtown apartments are located in the heart of the activity center, just steps from the Westside Provisions District’s upscale retail and dining. AMLI Westside is also within walking distance of “The Silicon Crescent,” Midtown’s Technology Office Boom.AMLI Westside offers luxurious amenities intertwined with curated artwork, including a salt water pool with cabanas and grilling stations; rooftop lounge with bar, games, TVs and scenic views; fitness studio with strength, cross-fit and cardio equipment; clubroom with kitchen, billiards and arcade games; private offices and conference room; library with lounge seating; community work spaces; bike repair shop and storage; and much more.AMLI Westside offers spacious studio, one- and two-bedroom floor plans featuring two designer finish packages, chefs’ kitchens with premium stainless steel appliances, quartz countertops in kitchens and baths, plank flooring, mud rooms with storage bench, washer and dryer in every apartment, 10’ or 18’ foot ceiling heights, Industrial chic lighting and cabinet hardware, and more.Smoke-free inside and out and focused on green living, AMLI Westside offers residents a healthier lifestyle with lower environmental impact.'"
d4t27el,The Baxter Decatur Apartments,1605 Church St,Decatur,GA,30033,678-647-8765,17,44,4.8,33.79438,-84.28206,"'A new level of sophistication for apartment living has arrived. With surroundings to savor and places to share. Modern touches and unrivaled conveniences. World-class amenities. Superior features. Set in the vibrant neighborhood of Decatur and adjacent to North Decatur Station. Anchored by Whole Foods Market, North Decatur Station features a host of shopping and restaurants right at your doorstep. The Baxter Decatur features a collection of thoughtfully designed studio, one, two, and three-bedroom apartment homes. This new apartment community is just minutes from downtown Atlanta. Yet a world apart. It’s The Baxter Decatur – and it’s like nothing you’ve seen before.'"
l4sx76d,The Keswick,5126 Peachtree Blvd,Chamblee,GA,30341,470-499-2406,47,20,4.9,33.88947,-84.3129,"""Those who yearn for luxury living in Chamblee, GA finally have a place to call home. Mirroring the elegance and refinement, The Keswick's setting beautifully captures serenity and grace. Our apartments exhibit exquisite architecture and lavish interior designs. We have masterfully blended modern boutique chic with a sophisticated style to satisfy our residents’ high-class tastes. The Keswick is also proud to deliver first-rate pampering that focuses on health and wellness. Our upscale dwellings are designed to accommodate all your needs. But if you want to spread your social wings, you are within walking distance of various fine dining, retail, entertainment, and recreation options. Welcome to wonderful. Welcome to The Keswick."""
j4gzqe4,Spoke Apartments,1450 La France St NE,Atlanta,GA,30307,404-476-4874,12,13,4.6,33.761,-84.34115,"'Brand new studio, one, and two bedroom apartments in Atlanta’s Edgewood neighborhood. Steps away from the Edgewood-Candler Park MARTA rail station, shopping, dining, and a welcome retreat for true urbanist souls. For those who align with clever over hipster, say hello to a bespoke mode of living where urbanity meets savvy simplicity and the results are urban apartments that intelligently outlast hip.'"
